{
  "$schema": "../../../schema/invoice-config.schema.json",
  "version": 1,
  "tax_model": "vat",
  "presentation": {
    "language": "fr",
    "format_locale": "fr-FR",
    "currency": "EUR",
    "layout": "international",
    "paper": "a4"
  },
  "default_tax": "standard",
  "taxes": {
    "standard": {
      "category": "S",
      "rate": "20"
    }
  },
  "required_fields": [
    "data.metadata.delivery_date"
  ],
  "notes": [
    "Démonstration : entreprises, coordonnées bancaires et taux fictifs."
  ]
}
